{"always_exclude":["**/.DS_Store","**/.git/**","**/.idea/**","**/.vscode/**","**/__pycache__/**","**/*.pyc","**/*.pyo","**/*.profraw","**/*.profdata","**/coverage/**","**/dist/**","**/node_modules/**","**/target/**","**/.mypy_cache/**","**/.pytest_cache/**","**/.ruff_cache/**","**/.tmp/**","**/.venv/**","**/.coverage","**/htmlcov/**",".mypy_cache/**",".pytest_cache/**",".ruff_cache/**",".tmp/**",".venv/**","artifacts/**","findings/**","reports/**"],"archives":[{"contract":"packaging/beta/contracts/source-archive.v1.json","filename":"cigar-0.1.0-beta.1-source.tar.gz","id":"source","include":["**"]},{"contract":"packaging/beta/contracts/docs-archive.v1.json","filename":"cigar-0.1.0-beta.1-docs.tar.gz","id":"docs","include":["LICENSE","NOTICE","docs/release/BETA_USER_GUIDE.md","crates/cigar-cli/assets/cigar-help-beta.txt","packaging/beta/README.md","packaging/beta/capability-policy.v1.json","packaging/beta/product-version.v1.json","packaging/beta/release-profile.v1.json"]},{"contract":"packaging/beta/contracts/schemas-archive.v1.json","filename":"cigar-0.1.0-beta.1-schemas.tar.gz","id":"schemas","include":["LICENSE","NOTICE","packaging/beta/*.json","packaging/beta/contracts/**","packaging/beta/schemas/**"]},{"contract":"packaging/beta/contracts/conformance-archive.v1.json","filename":"cigar-0.1.0-beta.1-conformance.tar.gz","id":"conformance","include":["LICENSE","NOTICE","crates/cigar-cli/assets/cigar-help-beta.txt","packaging/beta/conformance/check_beta.py","packaging/beta/artifact-matrix.v1.json","packaging/beta/capability-policy.v1.json","packaging/beta/product-version.v1.json","packaging/beta/release-profile.v1.json","scripts/release/release_lib.py"]},{"contract":"packaging/beta/contracts/license-archive.v1.json","filename":"cigar-0.1.0-beta.1-licenses.tar.gz","id":"licenses","include":["LICENSE","NOTICE","packaging/licenses/Apache-2.0.txt","packaging/licenses/beta-third-party-inventory.v1.json","packaging/licenses/beta-third-party-license-files/**","packaging/licenses/beta-third-party-license-manifest.v1.json","packaging/licenses/rust/COPYRIGHT-library.html","packaging/licenses/third-party-policy.v1.json"]}],"product_version":"0.1.0-beta.1","release_profile":"cigar.beta.embedded-local.linux-x86_64.v1","schema_version":"cigar.beta.source-archives.v1"}
